{
  "$schema": "./index.schema.json",
  "title": "Daily Updates",
  "subtitle": "Short, dated shipping notes — linked to docs, demos, or code.",
  "initial_open_days": 3,
  "page_size_days": 20,
  "days": [
    "2026-08-02",
    "2026-08-01",
    "2026-07-31",
    "2026-07-30",
    "2026-07-29",
    "2026-07-28",
    "2026-07-27",
    "2026-07-26",
    "2026-07-25",
    "2026-07-24",
    "2026-07-23",
    "2026-07-22",
    "2026-07-21",
    "2026-07-20",
    "2026-07-19",
    "2026-07-18",
    "2026-07-17",
    "2026-07-16",
    "2026-07-15",
    "2026-07-14",
    "2026-07-13",
    "2026-07-12",
    "2026-07-11",
    "2026-07-10",
    "2026-07-09",
    "2026-07-08",
    "2026-07-07",
    "2026-07-06",
    "2026-07-05",
    "2026-07-04",
    "2026-07-03",
    "2026-07-02",
    "2026-07-01",
    "2026-06-30",
    "2026-06-29",
    "2026-06-28",
    "2026-06-27",
    "2026-06-26",
    "2026-06-25",
    "2026-06-24",
    "2026-06-23",
    "2026-06-22",
    "2026-06-21",
    "2026-06-20",
    "2026-06-19",
    "2026-06-18",
    "2026-06-17",
    "2026-06-16",
    "2026-06-15",
    "2026-06-14",
    "2026-06-13",
    "2026-06-11",
    "2026-06-10",
    "2026-06-09",
    "2026-06-08",
    "2026-06-07",
    "2026-06-06",
    "2026-06-05",
    "2026-06-04",
    "2026-06-03",
    "2026-06-02",
    "2026-06-01",
    "2026-05-31",
    "2026-05-30",
    "2026-05-29",
    "2026-05-28",
    "2026-05-27",
    "2026-05-26",
    "2026-05-25",
    "2026-05-24",
    "2026-05-23",
    "2026-05-22",
    "2026-05-20",
    "2026-05-19",
    "2026-05-18",
    "2026-05-17",
    "2026-05-16",
    "2026-05-15",
    "2026-05-14",
    "2026-05-13",
    "2026-05-12",
    "2026-05-11",
    "2026-05-10",
    "2026-05-09",
    "2026-05-08",
    "2026-05-07",
    "2026-05-06",
    "2026-05-05",
    "2026-05-04",
    "2026-05-03",
    "2026-05-02",
    "2026-05-01",
    "2026-04-30",
    "2026-04-29",
    "2026-04-28",
    "2026-04-27",
    "2026-04-26",
    "2026-04-25",
    "2026-04-24",
    "2026-04-23",
    "2026-04-22",
    "2026-04-20",
    "2026-04-19",
    "2026-04-18",
    "2026-04-16",
    "2026-04-15",
    "2026-04-14",
    "2026-04-13",
    "2026-04-12",
    "2026-04-11",
    "2026-04-10",
    "2026-04-09",
    "2026-04-08",
    "2026-04-07",
    "2026-04-06",
    "2026-04-05",
    "2026-04-04",
    "2026-04-03",
    "2026-04-02",
    "2026-04-01",
    "2026-03-30",
    "2026-03-29",
    "2026-03-28",
    "2026-03-27",
    "2026-03-26",
    "2026-03-25",
    "2026-03-24",
    "2026-03-23",
    "2026-03-22",
    "2026-03-21",
    "2026-03-20",
    "2026-03-19",
    "2026-03-18",
    "2026-03-17",
    "2026-03-16",
    "2026-03-15",
    "2026-03-14",
    "2026-03-11",
    "2026-03-10",
    "2026-03-09",
    "2026-03-08",
    "2026-03-07",
    "2026-03-06",
    "2026-03-05",
    "2026-03-04",
    "2026-03-03",
    "2026-03-02",
    "2026-03-01",
    "2026-02-28",
    "2026-02-17",
    "2026-02-16",
    "2026-02-15",
    "2026-02-14",
    "2026-02-13",
    "2026-02-09",
    "2026-02-08",
    "2026-02-07",
    "2026-02-06",
    "2026-02-05",
    "2026-02-04",
    "2026-02-03",
    "2026-02-01",
    "2026-01-31",
    "2026-01-29",
    "2026-01-27",
    "2026-01-25",
    "2026-01-24",
    "2026-01-23",
    "2026-01-21",
    "2026-01-20",
    "2026-01-18",
    "2026-01-17",
    "2026-01-16",
    "2026-01-14",
    "2026-01-13",
    "2026-01-12",
    "2026-01-11",
    "2026-01-10",
    "2026-01-09",
    "2026-01-08",
    "2026-01-07",
    "2026-01-06",
    "2026-01-03",
    "2026-01-02",
    "2026-01-01"
  ]
}
